{
  "contract_version": "model-family-playbook.v1",
  "playbook_id": "integrated-three-statement",
  "version": "1.0.0",
  "family_id": "three_statement",
  "title": "Integrated three-statement",
  "purpose": "Project linked income statement, balance sheet and cash-flow outcomes.",
  "business_questions": ["How do operating assumptions affect profit, cash and the balance sheet together?", "Will projected statements remain internally consistent?"],
  "does_not_answer": ["What is the business worth without a valuation method?", "Will a lender approve financing?"],
  "appropriate_uses": ["Integrated financial planning", "Cash and balance-sheet forecasting", "Building an operating forecast prerequisite for valuation"],
  "inappropriate_uses": ["Valuation without explicit discount and terminal assumptions", "Planning from incomplete opening balances"],
  "decision_contexts": ["liquidity", "operating_plan", "valuation"],
  "outcome_terms": ["balance sheet forecast", "cash flow forecast", "integrated model", "integrated statements", "three statement"],
  "required_decisions": ["forecast horizon", "operating assumptions", "opening-balance treatment"],
  "required_data": ["balance_sheet_history", "capital_expenditure", "cash_flow_history", "debt_schedule", "income_statement_history", "working_capital"],
  "required_assumptions": ["forecast_horizon", "tax_rate"],
  "expected_outputs": ["three_statement_forecast"],
  "prerequisites": [],
  "follow_on_analyses": ["debt_capacity_refinancing", "operating_company_dcf"],
  "common_misunderstandings": ["Three statements placed in one workbook are not necessarily integrated.", "A balanced model is not automatically a reliable forecast."],
  "limitations": ["Requires complete opening balances."],
  "question_ids": ["forecast-horizon-known", "linked-statements-needed", "primary-decision"],
  "source_references": ["fmr-product-charter", "fast-standard-02c", "icaew-financial-modelling-code", "sec-financial-statement-data"],
  "review_state": "synthetic_reviewed"
}
