{
  "contract_version": "model-family-playbook.v1",
  "playbook_id": "operating-company-dcf",
  "version": "1.0.0",
  "family_id": "operating_company_dcf",
  "title": "Operating-company DCF",
  "purpose": "Estimate enterprise and equity value from explicit operating cash-flow assumptions.",
  "business_questions": ["What enterprise value follows from the forecast cash flows?", "What equity value remains after the net-debt bridge?"],
  "does_not_answer": ["Should the user invest or transact?", "What price will a buyer or market pay?"],
  "appropriate_uses": ["Operating-company valuation", "Acquisition valuation support when an operating forecast exists", "Sensitivity analysis around explicit valuation assumptions"],
  "inappropriate_uses": ["Investment recommendation", "Valuation without a supportable operating forecast", "Automatic use of an unexplained discount rate"],
  "decision_contexts": ["acquisition", "valuation"],
  "outcome_terms": ["business value", "dcf", "discounted cash flow", "enterprise value", "equity value", "valuation"],
  "required_decisions": ["discount rate", "forecast horizon", "terminal-value method"],
  "required_data": ["capital_expenditure", "cash_flow_history", "income_statement_history", "net_debt", "revenue_drivers", "working_capital"],
  "required_assumptions": ["discount_rate", "forecast_horizon", "tax_rate", "terminal_value_assumption"],
  "expected_outputs": ["enterprise_value", "equity_value", "operating_forecast"],
  "prerequisites": ["supported_operating_forecast"],
  "follow_on_analyses": [],
  "common_misunderstandings": ["A DCF result is not an investment recommendation.", "A mathematically valid terminal value may still depend on unsuitable assumptions."],
  "limitations": ["Not an investment recommendation."],
  "question_ids": ["operating-forecast-available", "primary-decision"],
  "source_references": ["fmr-product-charter", "icaew-financial-modelling-code"],
  "review_state": "synthetic_reviewed"
}
