{
  "contract_version": "model-family-playbook.v1",
  "playbook_id": "budget-forecast",
  "version": "1.0.0",
  "family_id": "budget_forecast",
  "title": "Budget and forecast",
  "purpose": "Project operating performance, liquidity and funding needs from explicit business drivers.",
  "business_questions": ["What operating result is expected?", "How may revenue, costs and cash needs change?"],
  "does_not_answer": ["What is the business worth?", "How much debt will a lender approve?"],
  "appropriate_uses": ["Annual operating planning", "Scenario comparison", "Runway and funding-needs planning"],
  "inappropriate_uses": ["Standalone business valuation", "Lender approval or credit decision"],
  "decision_contexts": ["liquidity", "operating_plan"],
  "outcome_terms": ["budget", "cash needs", "financial plan", "forecast", "operating plan", "runway"],
  "required_decisions": ["forecast horizon", "scenario definitions"],
  "required_data": ["income_statement_history", "operating_cost_drivers", "revenue_drivers"],
  "required_assumptions": ["forecast_horizon", "operating_cost_growth_rate", "revenue_growth_rate", "scenario", "scenario_adjustments"],
  "expected_outputs": ["budget_forecast"],
  "prerequisites": [],
  "follow_on_analyses": ["debt_capacity_refinancing", "operating_company_dcf", "three_statement"],
  "common_misunderstandings": ["A budget forecast is not automatically an integrated cash-flow model.", "A forecast is not a valuation opinion."],
  "limitations": ["Not a valuation opinion."],
  "question_ids": ["forecast-horizon-known", "linked-statements-needed", "primary-decision"],
  "source_references": ["fmr-product-charter", "fast-standard-02c", "icaew-financial-modelling-code"],
  "review_state": "synthetic_reviewed"
}
