{
  "contract_version": "model-family-playbook.v1",
  "playbook_id": "debt-capacity-refinancing",
  "version": "1.0.0",
  "family_id": "debt_capacity_refinancing",
  "title": "Debt capacity and refinancing",
  "purpose": "Assess debt service, leverage, liquidity and refinancing constraints under explicit terms.",
  "business_questions": ["Can projected cash flows service the proposed debt terms?", "How do refinancing terms affect leverage and covenant headroom?"],
  "does_not_answer": ["Will a lender approve the facility?", "What legal terms should the borrower accept?"],
  "appropriate_uses": ["Debt-capacity assessment", "Refinancing scenario analysis", "Covenant and repayment sensitivity"],
  "inappropriate_uses": ["Lending approval", "Legal review of financing documents", "Analysis without debt terms or operating cash-flow evidence"],
  "decision_contexts": ["financing", "liquidity", "refinancing"],
  "outcome_terms": ["covenant", "debt capacity", "debt service", "financing", "leverage", "refinancing"],
  "required_decisions": ["covenant thresholds", "interest assumptions", "repayment terms"],
  "required_data": ["cash_flow_history", "debt_schedule", "income_statement_history", "liquidity_position"],
  "required_assumptions": ["covenant_thresholds", "forecast_horizon", "interest_rate_assumption", "repayment_terms"],
  "expected_outputs": ["debt_capacity", "refinancing_analysis"],
  "prerequisites": [],
  "follow_on_analyses": ["three_statement"],
  "common_misunderstandings": ["Modelled capacity is not lender approval.", "Passing a modelled covenant does not establish compliance with legal documents."],
  "limitations": ["Does not constitute a lending decision."],
  "question_ids": ["debt-decision-needed", "forecast-horizon-known", "primary-decision"],
  "source_references": ["fmr-product-charter", "icaew-financial-modelling-code"],
  "review_state": "synthetic_reviewed"
}
